id,title,overview,genre,label
13068,Rocket Science,"O inusitado em Rocket Science começa desde seu protagonista: uma pessoa que gagueja instintivamente prefere os bastidores, os papéis secundários, mas Hal Hefner (vivido pelo ator revelação Reece Thompson) faz exatamente o movimento oposto. Estudante secundário em New Jersey, Hal decide tomar a mais improvável das atitudes para uma pessoa que gagueja: impelido por uma avassaladora paixão juvenil, resolve entrar no grupo de debates da escola e ir em busca de sua voz perdida.",Comédia,1
269579,Un Cuento de Circo & A Love Song,,Drama,2
22081,Blizzard,,Comédia,1
36102,A Trapaça,"Conta a história de um grupo de trapaceiros: Augusto (Broderick Crawford), Picasso (Richard Basehart) e Roberto (Franco Fabrizi), mostrando seus dramas pessoais, como o complicado relacionamento de Picasso com sua esposa, Iris (Giulietta Masina), ou entre Augusto e sua filha, Patricia (Sue Ellen Blake). Apesar de influenciado pelo gênero policial norte-americano, possui claras influências do neo-realismo, retratando uma Itália destruída pela guerra, sofrendo com a miséria e a fome.",Drama,2
83116,Cinzas ao Vento,,Drama,2
14525,À Deriva em Tóquio,Um bandido se oferece para pagar a dívida de jogo de um estudante de direito se ele o acompanhar em uma viagem por Tóquio.,Comédia,1
43028,Meu Passado Me Condena,"Um advogado proeminente enfrenta um chantagista que ameaça homens gays com divulgação de seus atos homossexuais (que ainda eram ilegais). Mas ele mesmo é gay.  Um verdadeiro pedido de reforma dos estatutos anti-sodomia da Inglaterra, este filme coloca Melville Farr, um advogado casado, contra um chantagista que tem fotos de Farr e um jovem gay no carro de Farr. O jovem é chantageado e se suicida. Após o suicídio, Farr localiza outros homens gays sendo extorquidos pelo mesmo chantagista. O bem-educado policial Detetive Inspetor Harris considera a lei de sodomia nada mais do que um auxílio a chantagistas, e ajuda Farr em enfrentar o blefe de seu chantagista. O filme, muito à frente de seu tempo, termina com Farr e sua esposa chegando a um acordo com sua homossexualidade depois da exposição pública que ele enfrenta no julgamento do chantagista. (e 18 - Estimado 18 Anos)",Drama,2
90355,O Jardineiro,"Após a estranha morte de seu antigo jardineiro, Ellen (Katharine Houghton), contrata o misterioso jardineiro Carl (Joe Dallesandro), que incrivelmente consegue transformar o seu jardim em algo além do que ela esperava. Sem perceber o novo jardineiro introduz plantas desconhecidas em seu terreno que emitem gases venenosos. Com o tempo o novo jardineiro demonstra que consegue se comunicar com as plantas e começa a influenciar os pensamentos de sua patroa, e alimentar as plantas com a carne das amigas de Ellen. Ellen começa a desconfiar que o jardineiro não seja tão humano como aparenta.",Terror,4
354788,ジョーカーゲーム,,Terror,4
12707,Orca: A Baleia Assassina,"Orca, uma baleia assassina, testemunhou a trágica morte de sua companheira prenha por Nolan, capitão de um navio pescador. A intenção era capturar um tubarão branco, mas o arpão acabou atingindo com tudo o animal. Inconformado, o macho levará toda a sua fúria e poder de morte para o porto de pescadores. Sob a pressão dos aldeões, Nolan terá que fazer alguma coisa para expulsar o animal das redondezas.",Terror,4
468287,Hannah,"Hannah é uma mulher de terceira idade que divide-se entre as aulas de teatro, a natação e o trabalho como empregada doméstica. Quando o marido vai preso, ela não tem alternativa a não ser a solidão e tenta refazer laços perdidos com descendentes, mas há um segredo na família que dificulta seu relacionamento com terceiros.",Drama,2
212156,The Garden of Sinners: Recordando o Verão,"Agosto de 1998. Neste momento, o bombista serial Meruka Kuramitsu está certo de sua vitória. Ele ativa um interruptor. Na explosão que se seguirá, o corpo de Shiki Ryougi se espalhará em pedaços. Shiki pode sobreviver à batalha contra esta pessoa com poder precognitivo?",Ficção científica,3
88029,小拳王,,Ação,0
458253,Link Perdido,"Sir Lionel Frost se considera o melhor investigador de mitos e monstros do mundo. O problema é que nenhum dos seus colegas o leva a sério. Sua última chance para ganhar seu respeito é provar a existência de um ancestral primitivo do homem, conhecido como o Link perdido.",Comédia,1
504608,Rocketman,"A trajetória de como o tímido Reginald Dwight (Taron Egerton) se transformou em Elton John, ícone da música pop. Desde a infância complicada, fruto do descaso do pai pela família, sua história de vida é contada através da releitura das músicas do superstar, incluindo a relação do cantor com o compositor e parceiro profissional Bernie Taupin (Jamie Bell) e o empresário e o ex-amante John Reid (Richard Madden).",Drama,2
209840,Cães Errantes,,Drama,2
940721,Godzilla Minus One,"Em um Japão social e economicamente devastado após o término da Segunda Guerra Mundial, a situação chega a um nível ainda mais crítico quando uma gigantesca e misteriosa criatura surge do mar para assolar o país.",Ficção científica,3
90523,Jornada Sinistra,,Drama,2
336004,O Sequestro do Ônibus 657,"Um pai está sem condições para pagar o tratamento médico de sua filha. Como último recurso, ele pede ajuda a um colega de trabalho ganancioso que propõe roubar um casino. Quando as coisas dão errado eles são forçados a seqüestrar um ônibus da cidade.",Ação,0
1112202,ആന്റണി,,Ação,0
72890,Minha Vida Dava um Filme,"Nada está dando certo na vida de Imogene (Kristen Wiig): seu namoro terminou, e sua carreira como dramaturga não deu certo. Sem dinheiro, ela é obrigada a voltar a morar com sua mãe excêntrica (Annette Bening), que vive com um jovem namorado mentiroso e um garoto, dormindo no antigo quarto de Imogene. Aos poucos, ela começa a compreender melhor a sua família e as suas raízes.",Comédia,1
259300,009ノ1（ゼロゼロクノイチ） THE END OF THE BEGINNING,,Ação,0
218221,女の園,,Drama,2
17165,劇場版 BLEACH Fade to Black 君の名を呼ぶ,"Alguém que porta uma foice ataca Mayuri, que estava em seu laboratório. Mayuri subitamente fica fora de controle e acaba acertando o painel de controle de seu laboratório. Com isso, toda a Seireitei fica coberta por uma nuvem de partículas espirituais, aprisionando todos os Shinigamis dentro de um casulo.",Ação,0
111614,நந்தா,,Drama,2
226188,Hidden Away,,Drama,2
105919,仇,,Ação,0
855483,无名,,Drama,2
62327,Terra Prometida,"Drama sobre três amigos e a chegada da vida adulta na cidadezinha de Ashville, Utah. Dave (Jason Gedrick) é o astro do time de futebol da escola. Melhor amigo de Danny (Kiefer Sutherland), ele namora Mary (Tracy Pollan), a chefe da torcida. E, dois anos após deixarem a escola, todos estão às voltas com os descaminhos da vida adulta.",Drama,2
52482,O Elefante Elmer,"O pequeno elefantinho Elmer chega a festa da tigresa Tillie. Durante a comemoração do aniversário de Tillie, os outros animais da floresta começam a rir do formato do nariz de Elmer. Cansado das brincadeiras, ele sai da festa e contra uma sábia girafa de idade, que explica que todos nós somos diferentes. Enquanto isso, a casa da árvore de Tillie pega fogo, e somente Elmer, com a ajuda da girafa e dos pelicanos conseguem juntos acabar com o fogo, salvamento Tillie.",Comédia,1
1034629,Em Busca de Mim,"Neste drama peculiar, uma mulher viaja sozinha para uma ilha italiana, mas acaba tendo uma experiência inesperada em um intenso retiro de autoajuda.",Drama,2
75832,O Grande Mestre da Morte,"Cheng é um jovem encrenqueiro que, certa vez, salva uma jovem de um assalto mas deixa o agressor escapar. O bandido e sua gangue voltam para acertar as contas e Cheng consegue vencer a luta apenas com a ajuda de seu tio, que sabe que é apenas questão de tempo até que seu sobrinho seja alvo de uma emboscada quando não estiver por perto. Ele então envia o rapaz para o interior, em um tempo nas montanhas, para aprender novas técnicas com um monge de Shaolin. Cheng logo recusa o rígido treinamento e volta para casa, apenas para encontrar seu tio assassinado. Tomado pela fúria, o jovem retoma seu treinamento para buscar vingança e lavar as ruas da cidade com o sangue dos bandidos.",Ação,0
805473,The Breach,,Terror,4
610326,The Antique,"Medea é uma georgiana que trabalha com restauração de móveis em um antiquário de São Petersburgo. Seu namorado, Lado, transporta antiguidades da Geórgia para a Rússia. Vadim Vadich é um idoso que mora sozinho e faz a inusitada proposta de vender seu apartamento com ele incluído. De alguma maneira, essas vidas estão prestes a se cruzar.",Drama,2
922087,Mark Antony,"Ambientado em 1995, Mark, um mecânico habilidoso e filho de um ex-gângster, se depara com um telefone que tem a capacidade de se conectar com o passado e tenta salvar sua mãe distante de um destino sombrio. Ao enfrentar o legado de sua própria família, Mark deve navegar pelas perigosas consequências da alteração do passado, pois isso causa repercussões imprevistas no presente.",Ficção científica,3
85194,Deadly Games,,Terror,4
57585,Olho Por Olho,"Em Bangkok, um importante empresário contrata o matador profissional Curtie Church (Djimon Hounsou) para acabar com uma quadrilha de traficantes de escravas brancas que sequestraram sua filha. Para esta sangrenta missão, Church vai contar com Jimmy (Kevin Bacon), seu fornecedor de armas. Mas no meio do caminho surge Mae (Jirantanin Pitakporntrakul), uma misteriosa prostituta que vai ajudá-lo a libertar as outras meninas, mas trará grandes consequências.",Ação,0
488350,The Antithesis,,Terror,4
10345,K-9: Um Policial Bom pra Cachorro,"Michael Dooley é um policial extravagante que necessita de alguma ajuda para lutar contra Lyman, um traficante de drogas que tem tentado matá-lo. Um conhecido lhe dá Jerry Lee, um pastor alemão que foi treinado para cheirar drogas. Com sua ajuda Dooley espera colocar seu inimigo atrás das grades, mas Jerry Lee tem uma personalidade bem própria e trabalha apenas quando quer. Por sua vez, o cachorro é ótimo para destruir o carro, a casa e a vida sexual de Dooley. Além disto, Tracy, a namorada de Michael Dooley, é seqüestrada por Lyman, que assim pretende deter Dooley, pois Lyman está prestes a entregar um carregamento de drogas que vale alguns milhões de dólares.",Ação,0
188836,小子命大,,Ação,0
357940,Sr. Seis,"Um chefão da máfia aposentado leva uma vida calma administrando uma loja de conveniência, mas o passado vem à tona quando seu filho se encrenca com uns garotos mimados.",Ação,0
8744,Ciladas da Sorte,"Três ladrões que cometem pequenos roubos são caçados pela polícia, que acredita que eles são realmente três grandes criminosos. O trio se refugia em um bar de porão e pegaram cinco reféns, incluindo todos os empregados do bar. Os ladrões tentam fugir do cerco policial mas é difícil, pois o bar é uma construção dos anos 20 com apenas uma saída. É quando um dos membros propõe que se use o ""jacaré albino"", que significa distrair a atenção do inimigo sacrificando o membro mais frágil do grupo, dando chance aos outros de fugirem.",Drama,2
176915,Sombras da Morte,"Chris perdeu seus pais há onze anos atrás, quando foram brutalmente assassinados no mesmo dia em que o cometa Halley podia ser visto a olho nu da Terra. Hoje à noite, um novo cometa passará perto do planeta e todos em seu prédio estão organizando uma festa para comemorar o evento. À medida que a hora vai chegando, as pessoas ao seu redor começam a agir de maneira estranha, ficando desorientadas e mais agressivas. Em uma luta pela sobrevivência, Chris tem que tentar escapar com a ajuda apenas de uma arma.",Terror,4
168742,The Rocket,,Drama,2
49815,Baleias de Agosto,"As velhas irmãs Libby e Sarah vivem juntas numa casa ampla no rochoso litoral do Maine, onde costumavam passar o verão desde a infância, sempre de olho nas baleias que aparecem em agosto. Agora Libby está cega e Sarah precisa cuidar dela. Ambas vivem de recordações da família, dos maridos e dos amigos. O sr. Maranov, um velho nobre russo fugido da Revolução de 1917, passa a visitá-las, mas é rechaçado asperamente por Libby, que teme que ele apenas queira se instalar na casa delas para aproveitar o pouco de dinheiro que ainda possuem.",Drama,2
209840,Cães Errantes,,Drama,2
336004,O Sequestro do Ônibus 657,"Um pai está sem condições para pagar o tratamento médico de sua filha. Como último recurso, ele pede ajuda a um colega de trabalho ganancioso que propõe roubar um casino. Quando as coisas dão errado eles são forçados a seqüestrar um ônibus da cidade.",Ação,0
369124,陪安东尼度过漫长岁月,,Drama,2
17906,Dummy: Um Amor Diferente,"Steven mora com seus excêntricos pais e sua irmã Heidi nos subúrbios. Eles o amam, mas não conseguem entendê-lo, nem tampouco sua obsessão pelo sonho de se tornar um ventríloco. Mas, num mundo rodeado por excêntricos e desajustados, seu sonho faz sentido. Sua melhor amiga Fangora é uma punk cheia de atitude e dona de um estilo único, um monte de maus conselhos e dona de um estilo único. Sua irmã Heidi é obcecada pela idéia de se casar de se casar com Michael. A única pessoa aparentemente normal é Lorena, sua conselheira profissional que deu a ele o primeiro trabalho como ventríloco. Quando todos esses talentos se juntam para participar da festa de casamento planejada por Heidi, todo o tipo de loucura pode acontecer…",Comédia,1
62327,Terra Prometida,"Drama sobre três amigos e a chegada da vida adulta na cidadezinha de Ashville, Utah. Dave (Jason Gedrick) é o astro do time de futebol da escola. Melhor amigo de Danny (Kiefer Sutherland), ele namora Mary (Tracy Pollan), a chefe da torcida. E, dois anos após deixarem a escola, todos estão às voltas com os descaminhos da vida adulta.",Drama,2
1807,Elefante,"Um dia aparentemente comum na vida de um grupo de adolescentes, todos estudantes de uma escola secundária de Portland, no estado de Oregon, interior dos Estados Unidos. Enquanto a maior parte está engajada em atividades cotidianas, dois alunos esperam, em casa, a chegada de uma metralhadora semi-automática, com altíssima precisão e poder de fogo. Munidos de um arsenal de outras armas que vinham colecionando, os dois partem para a escola, onde serão protagonistas de uma grande tragédia.",Drama,2
756982,Kamen Rider Zero-One: Real×Time,"O mundo acabará e a vida eterna nascerá. Aruto se transforma em Kamen Rider Zero-One Hell Rising Hopper enquanto luta contra o novo inimigo, Kamen Rider Eden! O que torna essa dinâmica interessante é que o nome de Kamen Rider Eden significa, ""paraíso"", enquanto a nova forma de Kamen Rider Zero-One representa ""inferno""! Como Aruto obteve essa nova forma?!",Ação,0
52482,O Elefante Elmer,"O pequeno elefantinho Elmer chega a festa da tigresa Tillie. Durante a comemoração do aniversário de Tillie, os outros animais da floresta começam a rir do formato do nariz de Elmer. Cansado das brincadeiras, ele sai da festa e contra uma sábia girafa de idade, que explica que todos nós somos diferentes. Enquanto isso, a casa da árvore de Tillie pega fogo, e somente Elmer, com a ajuda da girafa e dos pelicanos conseguem juntos acabar com o fogo, salvamento Tillie.",Comédia,1
45228,おたくのビデオ,,Comédia,1
373449,2.0,,Ação,0
65759,Happy Feet 2: O Pinguim,"Mano está de volta e o pinguim sapateador favorito de todos agora tem um filho, chamado Erik! Mano nasceu para dançar, mas o pequeno Erik simplesmente não consegue acompanhá-lo. Nesta épica seqüência de ""Happy Feet: O Pinguim"", Erik precisa descobrir qual seu talento em um mundo de canto e de dança. Quando a nação inteira dos Pinguins Imperadores é ameaçada, presa por um enorme iceberg, as pequenas e as grandes criaturas que habitam a Antártica precisam trabalhar juntas para salvá-los e somente aí que Erik descobre qual é sua praia. Se divirta com as aventuras destes pinguins que levam o público de volta às paisagens magníficas da Antártica, e sempre estão prontos para ganhar um combate e superar os obstáculos da vida com muita alegria e distração.",Comédia,1
9589,"Eu, Christiane F. - 13 Anos, Drogada e Prostituída","Na cidade de Berlin nos anos 70, Christiane, uma linda adolescente, mora com sua mãe e sua irmã menor em um típico apartamento da cidade. Ela é fascinada para conhecer a ""Sound"", uma nova e moderna discoteca. Apesar de menor de idade ela pede a sua amiga para leva-la lá ela conhece Detlev, assim ela se aproxima do terrível mundo das drogas. Primeiro é o álcool, depois a maconha, assim passo a passo ela começa a mergulhar cada vez mais profundamente no submundo do vício e da prostituição colocando-se à beira da morte.",Drama,2
76289,Terminus,,Ficção científica,3
419459,Conflitos Em Família,"Situado em Manhattan, no ano de 1995, o filme centra-se em duas irmãs que debatem o que fazer quando descobrem que seu pai está traindo sua mãe.",Comédia,1
28172,Banquete de Sangue,"Para organizar o jantar de aniversário da filha, Suzette, a Sra. Fremont contrata um reconhecido cozinheiro, Fuad Ramses. Este último vive obcecado pela deusa egípcia Ishtar e vê aí uma oportunidade única para homenageá-la. Tal como acontecia na Antiguidade, o Sr. Ramses vai cozinhar órgãos humanos obtidos através do assassinato de jovens mulheres virgens. Língua, pernas, cérebro, coração humano, nada pode faltar para o manjar do cozinheiro fanático! Entretanto, a polícia investiga. O inspector Thornton, apaixonado por Suzette, vai fazer tudo o que for possível para deter o psicopata, antes que o jantar seja servido.",Terror,4
10161,Meu Pé Esquerdo,"Christy Brown (Daniel Day-Lewis), o filho de uma humilde família irlandesa, nasce com uma paralisia cerebral que lhe tira todos os movimentos do corpo, com a exceção do pé esquerdo. Com apenas este movimento Christy consegue, no decorrer de sua vida, se tornar escritor e pintor.",Drama,2
387333,മാർക്ക് ആന്‍റണി,,Drama,2
880,A Excêntrica Família de Antônia,"Definido como uma celebração da vida e da morte, esta coprodução entre Holanda, Bélgica e Inglaterra ganhadora do Oscar de Melhor Filme Estrangeiro vai além ao contar a história de uma encantadora geração de mulheres. Comandada por Antonia, a saga familiar atravessa três gerações, falando de força, de beleza e de escolhas que desafiam o tempo. Nesse universo conhecemos curiosos personagens, como o filósofo pessimista, a netinha superdotada, a filha lésbica, a avó louca, o padre herege, a amiga que adora procriar, a vizinha que sofre abusos sexuais e os muitos amigos que são acolhidos por sua generosidade.",Drama,2
425298,Guerreiro da Escuridão,Zaid (Dar Salim) é um médico bem-sucedido que perde seu irmão mais novo durante um assalto relacionado a gangues. Ele desiste de sua vida privilegiada para se tornar um guerreiro mascarado e vingar a morte do seu irmão.,Ação,0
582309,Antígona - A Resistência está no Sangue,"Assim como a personagem da grande tragédia grega, para honrar um de seus irmãos e ajudar o outro a escapar da prisão, Antígona confronta as autoridades do Estado. Aluna e cidadã modelo, ela se vê cercada por uma lei falha. Rejeitando a lei dos homens por seu próprio senso de justiça, ela enfrentará dificuldades inimagináveis.",Drama,2
168742,The Rocket,,Drama,2
1036561,O Mestre das Sombras,"Depois de ser morto por um grupo de criminosos, um homem renasce com superpoderes semelhantes a animais e tem como missão corrigir os erros de sua cidade.",Ação,0
306623,ഇരകള്‍,,Drama,2
90148,De Amor e de Sombras,"Irene é uma editora de revista que vive sob a sombra da ditadura de Pinochet no Chile. Francisco é um belo fotógrafo que procura Irene para um trabalho. Como simpatizante do movimento de resistência clandestina, Francisco abre os olhos e o coração dela para as atrocidades cometidas pelo Estado.",Drama,2
567138,Elephants,,Comédia,1
62961,メタル スキン パニック MADOX-01,,Ficção científica,3
105482,Homens do Mosteiro,"A história dos ""Três Mosqueteiros"" asiáticos, Fang Shih-yu (Alexander Fu Sheng), Hung Hsi-kuan (Chen Kuan Tai) e Hu Huei Chien (Chi Kuan Chun). Nos últimos dias da dinastia Ming, a China está dominada por tropas Manchu. Os discípulos do Monastério Shaolin devem lutar ao lado de seus patriotas contra os invasores, colocando o destino da nação na mão dos homens do monastério.",Ação,0
127372,Imperador,"Inspirado em fatos reais, “Emperor” é uma épica história de amor passada no meio das tensões e incertezas dos dias seguintes à rendição japonesa, no final da Segunda Guerra Mundial. No meio do staff do general Douglas MacArthur – o governante de facto do Japão, na condição de Comandante Supremo das forças invasoras – um especialista nos assuntos japoneses, o general Bonner Fellers é encarregado de uma decisão de importância histórica: deverá o Imperador Hirohito ser julgado e enforcado como um criminoso de guerra?",Drama,2
63682,L'Eau à la bouche,,Comédia,1
64719,野良猫ロック　マシン・アニマル,,Ação,0
206027,Dumb Luck,,Comédia,1
65759,Happy Feet 2: O Pinguim,"Mano está de volta e o pinguim sapateador favorito de todos agora tem um filho, chamado Erik! Mano nasceu para dançar, mas o pequeno Erik simplesmente não consegue acompanhá-lo. Nesta épica seqüência de ""Happy Feet: O Pinguim"", Erik precisa descobrir qual seu talento em um mundo de canto e de dança. Quando a nação inteira dos Pinguins Imperadores é ameaçada, presa por um enorme iceberg, as pequenas e as grandes criaturas que habitam a Antártica precisam trabalhar juntas para salvá-los e somente aí que Erik descobre qual é sua praia. Se divirta com as aventuras destes pinguins que levam o público de volta às paisagens magníficas da Antártica, e sempre estão prontos para ganhar um combate e superar os obstáculos da vida com muita alegria e distração.",Comédia,1
10053,Quando um Estranho Chama,"Jill Johnson é uma jovem que está trabalhando como babá em uma remota casa, localizada no topo de uma colina. Com as crianças dormindo, ela tranca a porta e liga o alarme geral. É quando tem início uma série de telefonemas, em que uma pessoa estranha repetidamente insiste que ela cheque as crianças. Assustada, Jill consegue rastrear as ligações e descobre que as ligações são feitas dentro da própria casa.",Terror,4
64651,野良猫ロック　セックスハンター,,Ação,0
870358,O Natal do Pequeno Batman,"Neste Natal, Damian Wayne quer ser um super-herói igual ao pai dele - o primeiro e único Batman. Damian fica sozinho em casa enquanto o Batman sai para enfrentar os maiores supervilões de Gotham na Véspera de Natal, mas acaba descobrindo um plano maligno para roubar o Natal e aproveita a chance para salvar o dia.",Ação,0
13685,Pura Adrenalina,"Três jovens amigos em busca de um lugar ao sol acabam tornando-se foragidos. Mas cada um tem seu sonho particular: Anthony, o de encontrar um amor verdadeiro; Bob, o de ter uma família; e Dignam, o de ser um gângster respeitado.",Comédia,1
360784,Escondidos,"Uma família se esconde em um abrigo contra bombas depois de escapar de uma misteriosa epidemia pós apocalyptica, agora eles terão que lutar para sobreviver nessa misteriosa e angustiante história.",Terror,4
14092,Ghost in the Shell 2.0,"Pessoas amam máquinas em 2029 d.c. ""Quem é você? Quem desliza em meu corpo do robô e sussurra para o meu fantasma?""  A Seção 9 é uma agência do governo altamente secreta que trata de cyber-terrorismo e outros crimes relacionados. Kusanagi Motoko é uma importante oficial desta agência, e a ela é atribuido o caso do ""Mestre das Marionetes""; um hacker de alta periculosidade que começa a roubar informações secretas do governo ao hackear o ""ghost"" de suas vítimas.",Ação,0
29237,Choque!,,Drama,2
263341,O Tigre e o Dragão: A Espada do Destino,"Ambientado 20 anos após os acontecimentos de O Tigre e o Dragão, O Tigre e o Dragão: A Espada do Destino traz os mestres Yu Shu-Lien (Michelle Yeoh), Tie-Fang (Harry Shum Jr.), Meng Sizhao (Donnie Yen) e Snow Vase (Natasha Liu Bordizzo) de volta. Juntos, eles terão que unir forças para defender a lendária espada Destino Verde das mãos do temido Hades Dai (Jason Scott Lee).",Ação,0
123354,The Spanish Gardener,,Drama,2
2191,Stranded,,Ficção científica,3
1062722,Frankenstein,"Dr. Victor Frankenstein, um cientista brilhante, mas egoísta, dá vida a uma criatura em um experimento monstruoso que acaba levando à ruína tanto do criador quanto de sua trágica criação.",Terror,4
84907,De Volta ao Terror,"Quando um grupo de estudantes do ensino médio começa a cavar o passado infame de sua cidade, não imaginava que as coisas poderiam acabar mal. Julian (Johnny Pacar), o cineasta do grupo decide fazer o projeto escolar e desfrutar de sua tentativa de fazer filmes de terror baseado nos assassinatos de Harlan Diehl. Mas quando ele e seu amigo Nate (Jonathan Keltz), passam a assistir o conteúdo das imagens eles inconscientemente desbloqueiam um mal que possui as suas vítimas através de reprodução de vídeo e utiliza-os para fins maléficos, que se fecha sobre uma alma específica, ameaçando expor o segredo mais profundo e secreto da cidade.",Terror,4
