id,title,overview,genre,label
585,Monstros S.A.,"O astro do susto, Sulley, e seu falante assistente, Mike, trabalham na Monstros S.A., a maior fábrica de processamento de gritos da cidade de Monstrópolis. A principal fonte de energia do mundo dos monstros provém da coleta dos gritos das crianças humanas. Os monstros acreditam que as crianças são tóxicas, e entram em pânico quando uma menininha invade seu mundo. Sulley e Mike fazem de tudo para levar a garota de volta para casa, mas enfrentam desafios monstruosos e algumas situações hilárias em suas atrapalhadas aventuras.",Comédia,1
15516,Aniversário Macabro,Duas garotas vão assistir a show de rock e no caminho são atacadas por um bando de fugitivos. A vingança será orquestrada pelos pais de uma delas.,Terror,4
49186,緯度0大作戦,,Ficção científica,3
483455,Bungo Stray Dogs: DEAD APPLE,"Não houve época, na sociedade clandestina de Yokohama, a produzir tantos cadáveres do que aqueles 88 dias. Muitas organizações se envolveram no banho de sangue: a Guerra da Cabeça do Dragão. A Agência dos Detetives Armados tem um novo trabalho a fazer.",Comédia,1
566486,Antariksham 9000 KMPH,"As coordenadas de um antigo satélite da Índia, Mihira, foram perdidas com o potencial de causar estragos nas comunicações em todo o mundo. A vida do astronauta Dev virou de cabeça para baixo há cinco anos e agora ele ensina ciências em uma escola pública. Ele foi contratado para consertar o satélite, mas será essa a única razão pela qual ele concorda em voltar?",Ficção científica,3
948,Halloween - A Noite do Terror,"Na noite de Halloween de 1963, Michael Myers, de seis anos, assassina brutalmente sua irmã. Preso em uma instituição para doentes mentais sob os cuidados do dr. Sam Loomis, Michael cresce apenas para odiar. Em outubro de 1978, ele foge do hospital, seguido pelo dr. Loomis, que sabe que Michael vai matar novamente. O psicopata passa a perseguir a adolescente Laurie Strode e seus amigos, e prepara seu ataque mortal para a noite de Halloween.",Terror,4
834654,Atrás da Vida,"Pintou um clima entre os amigos de infância Sundar e Leela. Então, eles bolam um plano para convencer suas famílias, de religiões diferentes, a aceitarem o romance.",Comédia,1
269149,Zootopia: Essa Cidade é o Bicho,"Em uma cidade de animais antropomórficos, uma raposa fugitiva vigarista e um coelho policial recruta precisam trabalhar juntos para desvendar uma conspiração.",Comédia,1
269149,Zootopia: Essa Cidade é o Bicho,"Em uma cidade de animais antropomórficos, uma raposa fugitiva vigarista e um coelho policial recruta precisam trabalhar juntos para desvendar uma conspiração.",Comédia,1
1256208,E poi si vede,,Comédia,1
36797,Pirado no Espaço,"A primeira missão tripulada para Marte está prestes a partir. Durante o treinamento, um dos membros da equipe se acidenta e precisa ser substituído. A única pessoa que pode assumir essa tarefa é Fred Z. Randall, um mago da computação que trabalha na Nasa e sempre sonhou ser astronauta. Mas, como temia o chefe da missão, Fred acaba mesmo é causando uma série de problemas. E ele tem apenas uma chance de se redimir.",Comédia,1
204487,Owen Benjamin: High Five Til It Hurts,,Comédia,1
1610,Febre de Bola,"Torcedor fanático do Arsenal da Inglaterra desde a infância, Paul Ashworth é também um professor de inglês com a crise de meia-idade e cheio de dúvidas sobre seu relacionamento com Sarah. Disposto a acompanhar a melhor campanha de seu time nos últimos dezoito anos do campeonato nacional, ele sequer imagina que terá de enfrentar a revelação de que será pai pela primeira vez e as cobranças cada vez maiores de Sarah que, para seu desespero, não dá a mínima para os seus jogos de futebol.",Comédia,1
980168,The Cult of Humpty Dumpty,,Terror,4
14619,De Pernas Pro Ar,"Owen Peadman tem um dom para preparar coquetéis. Seu sonho é conseguir dinheiro para salvar o restaurante do pai e, por causa disto, decide se inscrever em um concurso de bartenders que ocorrerá em Hollywood. Ao chegar ele recebe a ajuda de seu tio Earl e passa a frequentar várias festas. Numa delas conhece Lisa Mancini, a bela namorada de um ator famoso, que guarda um segredo bastante íntimo dele.",Comédia,1
1256724,Meu Primeiro Amor de Verão,"Sasha passa as férias de verão com seus pais em um sanatório, onde ele consegue o papel principal para atuar em uma peça de teatro. Seu par romântico é Polina, uma funcionária do lugar por quem ele se apaixona profundamente.",Comédia,1
968602,Crazy Fellow,,Comédia,1
566486,Antariksham 9000 KMPH,"As coordenadas de um antigo satélite da Índia, Mihira, foram perdidas com o potencial de causar estragos nas comunicações em todo o mundo. A vida do astronauta Dev virou de cabeça para baixo há cinco anos e agora ele ensina ciências em uma escola pública. Ele foi contratado para consertar o satélite, mas será essa a única razão pela qual ele concorda em voltar?",Ficção científica,3
76494,O Que Esperar Quando Você Está Esperando,Os desafios e dificuldades da paternidade iminente transformam a vida de cinco casais de cabeça para baixo.,Comédia,1
968602,Crazy Fellow,,Comédia,1
19200,Neblina e Sombras,"Com um estrangulador em série à solta, uma contadora vagueia pela cidade em busca do grupo de vigilantes que pretende capturar o assassino.",Comédia,1
680,Pulp Fiction: Tempo de Violência,"Vincent Vega e Jules Winnfield são dois assassinos profissionais que trabalham fazendo cobranças para Marsellus Wallace, um poderosos gângster. Vega é forçado a sair com a garota do chefe, temendo passar dos limites. Enquanto isso, o pugilista Butch Coolidge se mete em apuros por ganhar uma luta que deveria perder.",Comédia,1
4232,Pânico,"Após uma série de mortes misteriosas, um grupo de amigos são ameaçados por um assassino. Em uma mistura de emoções fortes e muitos sustos, aqui a única coisa que se pode ter certeza é que todos são vítimas e todos são suspeitos.",Terror,4
1084199,Acompanhante Perfeita,"Josh e Iris parecem ser o casal ideal, até que um incidente mortal em uma viagem com amigos revela um segredo sombrio: Iris é uma androide criada para satisfazer Josh. E o que era para ser perfeito logo se torna incontrolável.",Terror,4
1326106,Kaiju No. 8: Missão de Reconhecimento,"O filme Kaiju No. 8: Missão de Reconhecimento apresenta uma recapitulação da primeira temporada, seguido por um episódio especial original intitulado A Folga de Hoshina.",Ficção científica,3
36797,Pirado no Espaço,"A primeira missão tripulada para Marte está prestes a partir. Durante o treinamento, um dos membros da equipe se acidenta e precisa ser substituído. A única pessoa que pode assumir essa tarefa é Fred Z. Randall, um mago da computação que trabalha na Nasa e sempre sonhou ser astronauta. Mas, como temia o chefe da missão, Fred acaba mesmo é causando uma série de problemas. E ele tem apenas uma chance de se redimir.",Comédia,1
434371,O Jardim,,Comédia,1
434371,O Jardim,,Comédia,1
1029281,Desconhecidos,"Um predador implacável rastreia uma mulher ferida pela natureza selvagem do Oregon, nos EUA. A mulher faz o possível para ser mais esperta que seu agressor, mas a cada momento de tensão ela fica mais fraca e menos capaz. Ele é um homem com uma missão e é apenas uma questão de tempo até capturar sua presa. Mas nada é o que parece, neste filme recheado de reviravoltas interessantes.",Terror,4
1352755,Manutenção Necessária,"Charlie, dona independente de uma oficina só para mulheres, precisa repensar seu futuro quando uma rede rival abre do outro lado da rua. Em busca de apoio, ela desabafa com um amigo anônimo online, sem saber que é Beau, o mesmo rival que ameaça seus negócios. Entre faíscas virtuais e reais, a verdade pode pôr tudo a perder.",Comédia,1
27205,A Origem,"Cobb é um ladrão habilidoso que comete espionagem corporativa infiltrando-se no subconsciente de seus alvos durante o estado de sono. Impedido de retornar para sua família, ele recebe a oportunidade de se redimir ao realizar uma tarefa aparentemente impossível: plantar uma ideia na mente do herdeiro de um império. Para realizar o crime perfeito, ele conta com a ajuda do parceiro Arthur, o discreto Eames e a arquiteta de sonhos Ariadne. Juntos, eles correm para que o inimigo não antecipe seus passos.",Ficção científica,3
253406,Drama em Familia,"Na véspera do ano novo de 1987, Jude conhece Eliza, uma garota de Nova York que se envolve com Teddy, o melhor amigo de Jude. Naquela noite, Teddy morre de overdose e Jude passa por um forte momento de luto, o que leva sua família a enviá-lo para morar com o pai, Les, em Nova York. Lá, seu destino cruza com o de Johnny, o meio irmão de Teddy, e, novamente, com o de Eliza, que engravidou naquela fatídica noite. Agora, os três jovens vão acabar se unindo para formar uma família para o filho de Teddy.",Comédia,1
406045,Mars Attacks the World,,Ficção científica,3
986097,GOAT,Um atleta promissor é convidado a treinar com a estrela da equipe que está prestes a se aposentar.,Terror,4
376292,Paradox,,Ficção científica,3
805052,Poliamor para principiantes,,Comédia,1
286223,Shadow Zombie,,Terror,4
20915,स्ट्रेट,,Comédia,1
27205,A Origem,"Cobb é um ladrão habilidoso que comete espionagem corporativa infiltrando-se no subconsciente de seus alvos durante o estado de sono. Impedido de retornar para sua família, ele recebe a oportunidade de se redimir ao realizar uma tarefa aparentemente impossível: plantar uma ideia na mente do herdeiro de um império. Para realizar o crime perfeito, ele conta com a ajuda do parceiro Arthur, o discreto Eames e a arquiteta de sonhos Ariadne. Juntos, eles correm para que o inimigo não antecipe seus passos.",Ficção científica,3
603,Matrix,"Thomas Anderson, um jovem programador de computador que mora em um cubículo escuro, é atormentado por estranhos pesadelos nos quais encontra-se conectado por cabos e contra sua vontade, em um imenso sistema de computadores do futuro. Em todas essas ocasiões, acorda gritando no exato momento em que os eletrodos estão para penetrar em seu cérebro. À medida que o sonho se repete, Anderson começa a ter dúvidas sobre a realidade. Por meio do encontro com os misteriosos Morpheus e Trinity, Thomas descobre que é, assim como outras pessoas, vítima da Matrix, um sistema inteligente e artificial que manipula a mente das pessoas, criando a ilusão de um mundo real enquanto usa os cérebros e corpos dos indivíduos para produzir energia. Morpheus, entretanto, está convencido de que Thomas é Neo, o aguardado messias capaz de enfrentar a Matrix e conduzir as pessoas de volta à realidade e à liberdade.",Ficção científica,3
519182,Meu Malvado Favorito 4,"Nesta sequência, o vilão mais amado do planeta retorna e agora Gru, Lucy, Margo, Edith e Agnes dão as boas-vindas a um novo membro da família: Gru Jr., que pretende atormentar seu pai. Enquanto se adapta com o pequeno, Gru enfrenta um novo inimigo, Maxime Le Mal, forçando sua namorada Valentina e a família a fugir do perigo.",Comédia,1
228326,Festa no Céu,"O jovem torero Manolo está dividido entre cumprir as expectativas de sua família ou seguir seu coração e se dedicar à sua verdadeira paixão: a música. Antes de escolher qual caminho seguir, ele embarca numa incrível aventura que o leva a três mundos fantásticos, onde irá enfrentar os seus maiores medos.",Comédia,1
96167,Manchas Solares,"Durante uma onda de calor em Roma causada por manchas solares, há muitos casos de suicídio. Uma médica desconfia que um desses casos é na verdade assassinato... Com trilha de Ennio Morricone, este é um dos mais criativos gialli de todos os tempos.",Terror,4
1296404,Good News,"Um grupo sequestra um avião japonês e exige pousar Pyongyang. Agora, um homem misterioso orquestrará um plano ousado e tentará redirecionar o voo para Seul.",Comédia,1
346698,Barbie,"No mundo mágico das Barbies, ""Barbieland"", uma das bonecas começa a perceber que não se encaixa como as outras. Depois de ser expulsa, ela parte para uma aventura no ""mundo real"", onde descobre que a beleza está no interior de cada um.",Comédia,1
301729,Terminus,"Na sequência de um acidente quase fatal, David Chamberlain faz uma descoberta sem precedentes, que não só irá determinar o destino da sua família, mas da humanidade.",Ficção científica,3
1376434,Predador: Assassino de Assassinos,"Essa antologia animada original acompanha três dos guerreiros mais determinados da história da humanidade: uma pirata viking que guia o filho em uma busca sangrenta por vingança, um ninja no Japão feudal que se volta contra o irmão samurai em uma batalha brutal pela sucessão e um piloto da Segunda Guerra Mundial que voa para investigar uma ameaça sobrenatural à causa aliada.",Ficção científica,3
253406,Drama em Familia,"Na véspera do ano novo de 1987, Jude conhece Eliza, uma garota de Nova York que se envolve com Teddy, o melhor amigo de Jude. Naquela noite, Teddy morre de overdose e Jude passa por um forte momento de luto, o que leva sua família a enviá-lo para morar com o pai, Les, em Nova York. Lá, seu destino cruza com o de Johnny, o meio irmão de Teddy, e, novamente, com o de Eliza, que engravidou naquela fatídica noite. Agora, os três jovens vão acabar se unindo para formar uma família para o filho de Teddy.",Comédia,1
286223,Shadow Zombie,,Terror,4
1097434,EVANGELION:3.0(-120min.),,Ficção científica,3
284275,Dick Smart 2.007,,Comédia,1
109563,Mega Scorpions,,Ficção científica,3
19995,Avatar,"Apesar de não ter mais os movimentos da perna, o ex-fuzileiro naval Jake Sully ainda sente que pode ser um guerreiro. Sua intuição começa a se tornar realidade quando ele viaja anos-luz até a estação espacial montada no Planeta Pandora. Habitado por grandes seres azuis, os Na´vi, o local tem uma atmosfera fatal para qualquer terrestre. Por isso, oficiais criaram o programa Avatar, em que um corpo biológico, híbrido de humano e Na´vi, pode ser comandado a distância.",Ficção científica,3
286025,Antisocial Behavior,,Terror,4
1100988,Extermínio: A Evolução,"Já se passaram quase três décadas desde que o vírus da raiva escapou de um laboratório de armas biológicas. Agora, sob uma quarentena rigidamente imposta, alguns conseguiram encontrar maneiras de sobreviver em meio aos infectados. Um desses grupos vive em uma pequena ilha, ligada ao continente por uma única passagem fortemente protegida. Quando um dos membros parte em uma missão rumo ao sombrio coração do continente, ele descobre segredos, maravilhas e horrores que transformaram não apenas os infectados, mas também outros sobreviventes.",Terror,4
100192,Ameaça sem Controle,,Ficção científica,3
69942,The Shadow Walkers,,Terror,4
37048,Mobile Suit Gundam 00: A Wakening of the Trailblazer,"A série começa em 2307 AD. AD do calendário Gregoriano. Nesta era os combustíveis fósseis acabaram e a humanidade na Terra, dividida basicamente entre três grandes blocos de poder, a Aliança Econômica Internacional ou UNION centralizada nos Estados Unidos, a Liga Reformista da Humanidade centralizada na China, Rússia e Índia, e a nova União Européia, AEU, desenvolveu um sistema de captação de energia solar composto por um anel externo no planeta com aproximadamente 50 mil quilômetros de comprimento. Mesmo no século XXIII a humanidade continua criando conflitos entre os blocos de poder e, cansados deste cenário de guerras sem fim, uma organização paramilitar possuindo 4 mobile suits chamados Gundam, resolveu lutar para unificar o mundo em um único bloco e acabar com todos as guerras de uma vez por todas. Esta organização se chama Celestial Being.",Ficção científica,3
1502943,Night of the Reaper,,Terror,4
32053,O Último Guerreiro,"Uma misteriosa praga destruiu a fauna e a flora do planeta - e conseqüentemente todos os alimentos. No ano de 2012, grupos de sobreviventes disputam o lixo à custa da própria vida. Apenas um deles conserva traços de humanidade - e poucos grãos, sementes de um futuro melhor, que tentam reconstruir através do plantio de vegetais geneticamente modificados. Quando os bandidos liderados por um tirano tentam invadir a fortaleza dos cientistas, o futuro da humanidade passa a depender de um único homem: o Último Guerreiro!",Ficção científica,3
111878,Shadow Zone: My Teacher Ate My Homework,"Jesse, de treze anos, é um típico adolescente que odeia sua professora, a Sra. Ao visitar uma loja de roupas vintage, Jesse vê uma boneca que se parece exatamente com sua temida professora e convence o lojista a vendê-la para ele. Quando Jesse acidentalmente perfura o braço da boneca com uma agulha de costura, ele fica chocado ao encontrar a Sra. Fink com o braço na tipóia no dia seguinte e fica assustado quando uma mancha no rosto da boneca aparece, exatamente onde a Sra. Fink tem.",Comédia,1
1326106,Kaiju No. 8: Missão de Reconhecimento,"O filme Kaiju No. 8: Missão de Reconhecimento apresenta uma recapitulação da primeira temporada, seguido por um episódio especial original intitulado A Folga de Hoshina.",Ficção científica,3
5622,E la Nave Va,"Em 1914, um navio de cruzeiro sai navegando de Nápoles com o objetivo de espalhar as cinzas da amada cantora de ópera Edmea Tetua perto da ilha de Erimo, local de  nascimento da cantora. Durante a viagem, a variedade eclética de passageiros descobre um grupo de refugiados sérvios a bordo do navio. A paz e a camaradagem reina até que o navio é abordado por uma nau capitânia austríaca. Os sérvios são obrigados a abandoná-lo, mas, naturalmente, eles resistem, iniciando uma escaramuça que acaba em destruição.",Comédia,1
19551,Shadow Puppets,,Terror,4
100192,Ameaça sem Controle,,Ficção científica,3
111878,Shadow Zone: My Teacher Ate My Homework,"Jesse, de treze anos, é um típico adolescente que odeia sua professora, a Sra. Ao visitar uma loja de roupas vintage, Jesse vê uma boneca que se parece exatamente com sua temida professora e convence o lojista a vendê-la para ele. Quando Jesse acidentalmente perfura o braço da boneca com uma agulha de costura, ele fica chocado ao encontrar a Sra. Fink com o braço na tipóia no dia seguinte e fica assustado quando uma mancha no rosto da boneca aparece, exatamente onde a Sra. Fink tem.",Comédia,1
69942,The Shadow Walkers,,Terror,4
1215106,หมู่บ้านโค-กะโหลก,,Comédia,1
32053,O Último Guerreiro,"Uma misteriosa praga destruiu a fauna e a flora do planeta - e conseqüentemente todos os alimentos. No ano de 2012, grupos de sobreviventes disputam o lixo à custa da própria vida. Apenas um deles conserva traços de humanidade - e poucos grãos, sementes de um futuro melhor, que tentam reconstruir através do plantio de vegetais geneticamente modificados. Quando os bandidos liderados por um tirano tentam invadir a fortaleza dos cientistas, o futuro da humanidade passa a depender de um único homem: o Último Guerreiro!",Ficção científica,3
945961,Alien: Romulus,"Enquanto vasculham as profundezas de uma estação espacial abandonada, um grupo de jovens colonizadores espaciais se depara com a forma de vida mais aterrorizante do universo.",Terror,4
29492,Reformatório de Garotas,"Jenny é enviada para uma escola de reforma feminina. É dirigido pelo maldoeiro Sutter e sua capanga Edna. Jenny não vai parar por nada para escapar, mas ela também tem que lidar com Charlie, o valentão.",Comédia,1
4247,Todo Mundo em Pânico,"Depois do assassinato de uma bela colega de classe, um grupo de adolescentes desorientados descobre que há um assassino entre eles. A heroína Cindy Campbell e a sua turma de amigos mauricinhos e patricinhas, tentam se proteger do perigo... Mas uma reporter irritante, Gail Hailstorm, simplesmente não os deixa em paz! Parece familiar? Talvez sim, mas essa história repleta de reviravoltas e surpresas horripilantes e humor ultrajante extrapola no gênero de horror e ação.",Comédia,1
450654,Out of the Shadows,,Terror,4
20609,30.000 Léguas Submarinas,,Ficção científica,3
197624,AE: Apocalipse Terra,"Após a destruição da Terra, um grupo de sobreviventes chega a um planeta exótico e, para sobreviver, precisa combater uma raça de impiedosos alienígenas.",Ficção científica,3
1151334,Motorista de Fuga,Uma motorista fugitiva aposentada é arrastada de volta ao seu passado desagradável quando um ex-empregador lhe oferece a chance de salvar a vida de seu ex-namorado indigno de confiança.,Comédia,1
360408,Jeff Dunham: Unhinged in Hollywood,"Jeff Dunham estrela neste especial de uma hora na mundialmente famosa Dolby Theatre, em Hollywood.  A transmissão apresenta uma performance ao vivo com o astro da música country, Brad Paisley, assim como um nunca antes visto stand-up e bastidores das cenas com Dunham e seus excêntricos e queridos personagens.",Comédia,1
218388,"$1,000 a Minute",,Comédia,1
603,Matrix,"Thomas Anderson, um jovem programador de computador que mora em um cubículo escuro, é atormentado por estranhos pesadelos nos quais encontra-se conectado por cabos e contra sua vontade, em um imenso sistema de computadores do futuro. Em todas essas ocasiões, acorda gritando no exato momento em que os eletrodos estão para penetrar em seu cérebro. À medida que o sonho se repete, Anderson começa a ter dúvidas sobre a realidade. Por meio do encontro com os misteriosos Morpheus e Trinity, Thomas descobre que é, assim como outras pessoas, vítima da Matrix, um sistema inteligente e artificial que manipula a mente das pessoas, criando a ilusão de um mundo real enquanto usa os cérebros e corpos dos indivíduos para produzir energia. Morpheus, entretanto, está convencido de que Thomas é Neo, o aguardado messias capaz de enfrentar a Matrix e conduzir as pessoas de volta à realidade e à liberdade.",Ficção científica,3
94831,The Fuller Brush Girl,,Comédia,1
1083433,Eu Sei o Que Vocês Fizeram no Verão Passado,"Quando cinco amigos inadvertidamente causam um acidente de carro fatal, eles encobrem o envolvimento e fazem um pacto para manter o segredo em vez de arcar com as consequências. Um ano depois, o passado volta para assombrá-los e eles são forçados a confrontar uma verdade terrível: alguém sabe o que eles fizeram no verão passado... e está determinado a se vingar. À medida que os amigos são perseguidos, um a um, por um assassino, descobrem que isso já aconteceu antes e recorrem a dois sobreviventes do lendário Massacre de Southport, em 1997, em busca de ajuda.",Terror,4
197624,AE: Apocalipse Terra,"Após a destruição da Terra, um grupo de sobreviventes chega a um planeta exótico e, para sobreviver, precisa combater uma raça de impiedosos alienígenas.",Ficção científica,3
1241470,Osíris,"Comandos das Forças Especiais são sequestrados em plena operação por uma nave espacial misteriosa e, ao despertar, eles se veem vítimas de uma raça alienígena implacável em uma luta pela sobrevivência.",Ficção científica,3
20609,30.000 Léguas Submarinas,,Ficção científica,3
198663,Maze Runner: Correr ou Morrer,"Num cenário pós-apocalíptico, uma comunidade de rapazes descobre que estão presos num labirinto misterioso. Juntos, terão de descobrir como escapar, resolver o enigma e revelar o arrepiante segredo acerca de quem os colocou ali e por que razão.",Ficção científica,3
822119,Capitão América: Admirável Mundo Novo,"Após se encontrar com o recém-eleito presidente dos EUA, Thaddeus Ross, Sam se vê no meio de um incidente internacional. Ele deve descobrir o motivo por trás de uma conspiração global nefasta antes que o verdadeiro gênio faça o mundo inteiro ser dominado pelo vermelho.",Ficção científica,3
870360,Looney Tunes - O Filme: O Dia Que a Terra Explodiu,"Gaguinho e Patolino, a clássica dupla estranha animada, se transformam em heróis improváveis ​​quando suas palhaçadas na fábrica de chicletes local descobrem um plano secreto de controle mental alienígena. Contra todas as probabilidades, os dois estão determinados a salvar sua cidade (e o mundo!)... isto é, se eles não enlouquecerem um ao outro no processo.",Ficção científica,3
36604,Perfect Life,,Terror,4
1083433,Eu Sei o Que Vocês Fizeram no Verão Passado,"Quando cinco amigos inadvertidamente causam um acidente de carro fatal, eles encobrem o envolvimento e fazem um pacto para manter o segredo em vez de arcar com as consequências. Um ano depois, o passado volta para assombrá-los e eles são forçados a confrontar uma verdade terrível: alguém sabe o que eles fizeram no verão passado... e está determinado a se vingar. À medida que os amigos são perseguidos, um a um, por um assassino, descobrem que isso já aconteceu antes e recorrem a dois sobreviventes do lendário Massacre de Southport, em 1997, em busca de ajuda.",Terror,4
1502943,Night of the Reaper,,Terror,4
65272,The Shadow of Chikara,,Terror,4
36604,Perfect Life,,Terror,4
1083433,Eu Sei o Que Vocês Fizeram no Verão Passado,"Quando cinco amigos inadvertidamente causam um acidente de carro fatal, eles encobrem o envolvimento e fazem um pacto para manter o segredo em vez de arcar com as consequências. Um ano depois, o passado volta para assombrá-los e eles são forçados a confrontar uma verdade terrível: alguém sabe o que eles fizeram no verão passado... e está determinado a se vingar. À medida que os amigos são perseguidos, um a um, por um assassino, descobrem que isso já aconteceu antes e recorrem a dois sobreviventes do lendário Massacre de Southport, em 1997, em busca de ajuda.",Terror,4
1502943,Night of the Reaper,,Terror,4
65272,The Shadow of Chikara,,Terror,4
